{
  "$schema": "https://json-schema.org/draft/2020-12/schema",
  "title": "Scaffold Manifest",
  "type": "object",
  "additionalProperties": false,
  "required": [
    "description",
    "templateName",
    "expectedFiles",
    "expectedDirectories",
    "allowedFilePatterns",
    "forbiddenPaths",
    "forbiddenContentPatterns"
  ],
  "properties": {
    "$schema": {
      "type": "string"
    },
    "description": {
      "type": "string"
    },
    "templateName": {
      "type": "string",
      "minLength": 1
    },
    "expectedFiles": {
      "type": "array",
      "items": {
        "type": "string",
        "minLength": 1
      },
      "uniqueItems": true
    },
    "expectedDirectories": {
      "type": "array",
      "items": {
        "type": "string",
        "minLength": 1
      },
      "uniqueItems": true
    },
    "allowedFilePatterns": {
      "type": "array",
      "items": {
        "type": "string",
        "minLength": 1
      },
      "uniqueItems": true
    },
    "forbiddenPaths": {
      "type": "array",
      "items": {
        "type": "string",
        "minLength": 1
      },
      "uniqueItems": true
    },
    "forbiddenContentPatterns": {
      "type": "array",
      "items": {
        "type": "object",
        "additionalProperties": false,
        "required": [
          "path",
          "pattern",
          "description"
        ],
        "properties": {
          "path": {
            "type": "string",
            "minLength": 1
          },
          "pattern": {
            "type": "string",
            "minLength": 1
          },
          "description": {
            "type": "string",
            "minLength": 1
          }
        }
      }
    }
  }
}
